{
  "$schema": "http://json-schema.org/draft-07/schema#",
  "title": "About",
  "description": "Biographical information, contact details, availability status, and education.",
  "type": "object",
  "required": ["bio", "email", "status"],
  "additionalProperties": false,
  "properties": {
    "bio": {
      "type": "string",
      "description": "Short biography paragraph.",
      "minLength": 1
    },
    "email": {
      "type": "string",
      "description": "Contact email address.",
      "minLength": 1
    },
    "cli": {
      "type": "string",
      "description": "SSH address for the terminal portfolio."
    },
    "status": {
      "type": "string",
      "description": "Current availability or professional status.",
      "minLength": 1
    },
    "education": {
      "type": "array",
      "description": "List of educational credentials.",
      "items": {
        "type": "object",
        "description": "A single education entry.",
        "required": ["institution", "degree", "year"],
        "additionalProperties": false,
        "properties": {
          "institution": {
            "type": "string",
            "description": "Name of the school or university.",
            "minLength": 1
          },
          "degree": {
            "type": "string",
            "description": "Degree or certification earned.",
            "minLength": 1
          },
          "year": {
            "type": "string",
            "description": "Graduation year.",
            "minLength": 1
          }
        }
      }
    },
    "interests": {
      "type": "array",
      "description": "List of professional or personal interests.",
      "items": {
        "type": "string",
        "description": "A single interest.",
        "minLength": 1
      }
    }
  }
}
