{
  "bio": "Kyle McCormick is the founder of Gravity Plan, a creative engineering practice in Nashville. Since 2011, he has designed brands, built software, and shipped generative AI pipelines for clients across industries â€” bridging the gap between design vision and production code.",
  "status": "Open to opportunities",
  "email": "hi@kpm.fyi",
  "cli": "ssh.kpm.fyi"
}
